<?xml version="1.0" encoding="UTF-8"?>

<chord-chart xmlns="https://m9j.github.io/chord-chart/xmldef"
    xmlns:xsi="http://www.w3.org/2001/XMLSchema-instance"
    xsi:schemaLocation="https://m9j.github.io/chord-chart/xmldef chord-chart.xsd">
    <keyWhite note="C" isPressed="Y" />
    <keyBlack note="C" />
    <keyWhite note="D" />
    <keyBlack note="D" />
    <keyWhite note="E" isPressed="Y" />
    <keyWhite note="F" />
    <keyBlack note="F" />
    <keyWhite note="G" isPressed="Y" />
    <keyBlack note="G" />
    <keyWhite note="A" />
    <keyBlack note="A" />
    <keyWhite note="B" />
</chord-chart>